{"schemaVersion":"1.0.0","provider":"chatgpt","engineVersion":"1.0.0","promptVersion":"1.3.0","generatedAt":"2026-09-04T15:08:27Z","market":"NASDAQ-100","instruments":["NQ_FUTURES","NAS100_CFD"],"status":"green","statusText":"Mapped policy state: EA_ON. Tail remains low because the post-payroll path continues to show meaningful two-sided retracement, while Stress remains extreme.","recommendation":"Current policy mapping is EA_ON; the remaining post-payroll window still carries event/whipsaw Stress, with Tail dependent on whether directional efficiency rebuilds before the danger window ends.","headline":"Two-sided post-payroll trade keeps Tail low as rate Stress stays extreme","body":"August payrolls rose by 162,000 with unemployment unchanged at 4.1%, lifting Treasury-rate expectations. Delayed NQ at 29,567.50 remained well inside a 29,503.25–29,704.50 session range after both a sharp selloff and rebound, while broader equity performance stayed mixed. The observed path still shows meaningful counter-moves rather than persistent mean-reversion failure; Gulf supply disruption keeps background Stress extreme.","tailRiskPct":18,"tailLevel":"low","stressRiskPct":99,"stressLevel":"extreme","dominantMode":"event/whipsaw","confidencePct":96,"confidenceLevel":"very-high","action":"EA_ON","dangerWindow":{"start":"2026-09-04T12:15:00Z","end":"2026-09-04T15:30:00Z"},"dangerWindowBerlin":{"start":"2026-09-04T14:15:00+02:00","end":"2026-09-04T17:30:00+02:00"},"sources":[{"title":"BLS Employment Situation — August 2026","url":"https://www.bls.gov/news.release/archives/empsit_09042026.htm"},{"title":"Reuters — S&P 500, Dow slide after jobs report fuels rate-hike bets","url":"https://www.reuters.com/business/nasdaq-sp-500-futures-climb-ahead-key-jobs-report-2026-09-04/"},{"title":"Investing.com — Nasdaq 100 Futures Sep 2026","url":"https://www.investing.com/indices/nq-100-futures"},{"title":"Reuters — Oil heads for weekly gain as US-Iran fighting resumes","url":"https://www.reuters.com/business/energy/oil-set-steepest-weekly-gain-since-mid-july-over-intensifying-us-iran-tensions-2026-09-04/"},{"title":"Federal Reserve — September 2026 calendar","url":"https://www.federalreserve.gov/newsevents/2026-september.htm"},{"title":"BLS — September 2026 release schedule","url":"https://www.bls.gov/schedule/2026/09_sched_list.htm"}],"lookbackSummary":"Tail was elevated during Thursday's U.S. afternoon trend-up phase, declined overnight, and returned to WATCH as Friday's payroll event approached. It stayed at 24 through the release hour, then fell to low at 14:00 UTC as the observed post-payroll path showed a large retracement and rebound rather than persistent one-way extension.","lookback":[{"ts":"2026-09-03T15:00:00Z","timeBerlin":"2026-09-03T17:00:00+02:00","available":true,"status":"yellow","action":"WATCH","tailRiskPct":20,"stressRiskPct":100,"confidencePct":89,"dominantMode":"event/whipsaw"},{"ts":"2026-09-03T16:00:00Z","timeBerlin":"2026-09-03T18:00:00+02:00","available":true,"status":"yellow","action":"WATCH","tailRiskPct":24,"stressRiskPct":100,"confidencePct":89,"dominantMode":"trend-up"},{"ts":"2026-09-03T17:00:00Z","timeBerlin":"2026-09-03T19:00:00+02:00","available":true,"status":"yellow","action":"WATCH","tailRiskPct":24,"stressRiskPct":100,"confidencePct":89,"dominantMode":"trend-up"},{"ts":"2026-09-03T18:00:00Z","timeBerlin":"2026-09-03T20:00:00+02:00","available":true,"status":"orange","action":"BLOCK_NEW_BASE_ENTRIES","tailRiskPct":28,"stressRiskPct":100,"confidencePct":93,"dominantMode":"trend-up"},{"ts":"2026-09-03T19:00:00Z","timeBerlin":"2026-09-03T21:00:00+02:00","available":true,"status":"orange","action":"BLOCK_NEW_BASE_ENTRIES","tailRiskPct":27,"stressRiskPct":100,"confidencePct":93,"dominantMode":"trend-up"},{"ts":"2026-09-03T20:00:00Z","timeBerlin":"2026-09-03T22:00:00+02:00","available":true,"status":"orange","action":"BLOCK_NEW_BASE_ENTRIES","tailRiskPct":29,"stressRiskPct":100,"confidencePct":93,"dominantMode":"trend-up"},{"ts":"2026-09-03T21:00:00Z","timeBerlin":"2026-09-03T23:00:00+02:00","available":true,"status":"orange","action":"BLOCK_NEW_BASE_ENTRIES","tailRiskPct":27,"stressRiskPct":100,"confidencePct":94,"dominantMode":"trend-up"},{"ts":"2026-09-03T22:00:00Z","timeBerlin":"2026-09-04T00:00:00+02:00","available":true,"status":"yellow","action":"WATCH","tailRiskPct":24,"stressRiskPct":100,"confidencePct":88,"dominantMode":"mixed"},{"ts":"2026-09-03T23:00:00Z","timeBerlin":"2026-09-04T01:00:00+02:00","available":true,"status":"yellow","action":"WATCH","tailRiskPct":22,"stressRiskPct":100,"confidencePct":86,"dominantMode":"mixed"},{"ts":"2026-09-04T00:00:00Z","timeBerlin":"2026-09-04T02:00:00+02:00","available":true,"status":"yellow","action":"WATCH","tailRiskPct":21,"stressRiskPct":100,"confidencePct":84,"dominantMode":"mixed"},{"ts":"2026-09-04T01:00:00Z","timeBerlin":"2026-09-04T03:00:00+02:00","available":true,"status":"green","action":"EA_ON","tailRiskPct":18,"stressRiskPct":98,"confidencePct":88,"dominantMode":"mixed"},{"ts":"2026-09-04T02:00:00Z","timeBerlin":"2026-09-04T04:00:00+02:00","available":true,"status":"green","action":"EA_ON","tailRiskPct":17,"stressRiskPct":97,"confidencePct":87,"dominantMode":"normal"},{"ts":"2026-09-04T03:00:00Z","timeBerlin":"2026-09-04T05:00:00+02:00","available":true,"status":"green","action":"EA_ON","tailRiskPct":16,"stressRiskPct":98,"confidencePct":89,"dominantMode":"normal"},{"ts":"2026-09-04T04:00:00Z","timeBerlin":"2026-09-04T06:00:00+02:00","available":true,"status":"green","action":"EA_ON","tailRiskPct":19,"stressRiskPct":99,"confidencePct":89,"dominantMode":"normal"},{"ts":"2026-09-04T05:00:00Z","timeBerlin":"2026-09-04T07:00:00+02:00","available":true,"status":"yellow","action":"WATCH","tailRiskPct":20,"stressRiskPct":99,"confidencePct":91,"dominantMode":"mixed"},{"ts":"2026-09-04T06:00:00Z","timeBerlin":"2026-09-04T08:00:00+02:00","available":true,"status":"yellow","action":"WATCH","tailRiskPct":21,"stressRiskPct":100,"confidencePct":91,"dominantMode":"mixed"},{"ts":"2026-09-04T07:00:00Z","timeBerlin":"2026-09-04T09:00:00+02:00","available":true,"status":"yellow","action":"WATCH","tailRiskPct":22,"stressRiskPct":100,"confidencePct":95,"dominantMode":"mixed"},{"ts":"2026-09-04T08:00:00Z","timeBerlin":"2026-09-04T10:00:00+02:00","available":true,"status":"yellow","action":"WATCH","tailRiskPct":21,"stressRiskPct":100,"confidencePct":94,"dominantMode":"mixed"},{"ts":"2026-09-04T09:00:00Z","timeBerlin":"2026-09-04T11:00:00+02:00","available":true,"status":"yellow","action":"WATCH","tailRiskPct":24,"stressRiskPct":100,"confidencePct":95,"dominantMode":"trend-up"},{"ts":"2026-09-04T10:00:00Z","timeBerlin":"2026-09-04T12:00:00+02:00","available":true,"status":"yellow","action":"WATCH","tailRiskPct":24,"stressRiskPct":100,"confidencePct":95,"dominantMode":"trend-up"},{"ts":"2026-09-04T11:00:00Z","timeBerlin":"2026-09-04T13:00:00+02:00","available":true,"status":"yellow","action":"WATCH","tailRiskPct":24,"stressRiskPct":100,"confidencePct":95,"dominantMode":"trend-up"},{"ts":"2026-09-04T12:00:00Z","timeBerlin":"2026-09-04T14:00:00+02:00","available":true,"status":"yellow","action":"WATCH","tailRiskPct":24,"stressRiskPct":100,"confidencePct":96,"dominantMode":"event/whipsaw"},{"ts":"2026-09-04T13:00:00Z","timeBerlin":"2026-09-04T15:00:00+02:00","available":true,"status":"yellow","action":"WATCH","tailRiskPct":24,"stressRiskPct":100,"confidencePct":94,"dominantMode":"event/whipsaw"},{"ts":"2026-09-04T14:00:00Z","timeBerlin":"2026-09-04T16:00:00+02:00","available":true,"status":"green","action":"EA_ON","tailRiskPct":19,"stressRiskPct":100,"confidencePct":96,"dominantMode":"event/whipsaw"}],"outlookSummary":"Current post-payroll price discovery remains sufficiently two-sided to keep Tail low while Stress stays extreme. The remaining danger window ends at 15:30 UTC; Tail would rise only if directional efficiency rebuilds with repeated failed retracements or session-extreme holding. After the weekly close, the forecast shifts toward low Tail and elevated weekend gap/headline Stress.","forecast":[{"ts":"2026-09-04T15:00:00Z","timeBerlin":"2026-09-04T17:00:00+02:00","status":"green","action":"EA_ON","tailRiskPct":18,"stressRiskPct":99,"confidencePct":96,"dominantMode":"event/whipsaw","analysis":"Observed delayed NQ at 29,567.50 sits well inside a 29,503.25–29,704.50 session range after both a sharp post-payroll selloff and rebound. The two-sided path keeps Tail low even as rates and geopolitical Stress remain extreme.","drivers":["Observed NQ stayed inside a broad post-payroll range","Strong August payrolls lifted Treasury-rate expectations","Fresh supplementary context shows mixed tech confirmation","Hormuz disruption keeps energy headline Stress elevated"],"news":[{"title":"The Employment Situation — August 2026","url":"https://www.bls.gov/news.release/archives/empsit_09042026.htm","source":"U.S. Bureau of Labor Statistics"},{"title":"S&P 500, Dow slide after jobs report fuels rate-hike bets","url":"https://www.reuters.com/business/nasdaq-sp-500-futures-climb-ahead-key-jobs-report-2026-09-04/","source":"Reuters"},{"title":"Oil heads for weekly gain as US-Iran fighting resumes; diesel hits record high","url":"https://www.reuters.com/business/energy/oil-set-steepest-weekly-gain-since-mid-july-over-intensifying-us-iran-tensions-2026-09-04/","source":"Reuters"}]},{"ts":"2026-09-04T16:00:00Z","timeBerlin":"2026-09-04T18:00:00+02:00","status":"green","action":"EA_ON","tailRiskPct":17,"stressRiskPct":97,"confidencePct":95,"dominantMode":"mixed","analysis":"After the 15:30 UTC danger window ends, Tail stays low if meaningful retracements continue. A renewed one-way extension with repeated failed pullbacks would be the main condition for a fresh WATCH state.","drivers":["Post-payroll danger window ends at 15:30 UTC","Retracement quality remains the key Tail condition","Treasury repricing can amplify a renewed move"],"news":[]},{"ts":"2026-09-04T17:00:00Z","timeBerlin":"2026